{"schema":"https://debz.dev/schema/root-mutation-journal-v1","version":1,"attempt_id":"2222222222222222222222222222222222222222222222222222222222222222","attempt_generation":1,"attempt_digest_sha256":"3333333333333333333333333333333333333333333333333333333333333333","install_root":"/é","root_identity_sha256":"4444444444444444444444444444444444444444444444444444444444444444","authorization_sha256":null,"program_sha256":null,"plan_sha256":null,"exact_lock":{"schema":"https://debz.dev/schema/exact-closure-lock-v2","version":2,"digest_sha256":"6666666666666666666666666666666666666666666666666666666666666666"},"database_generation_sha256":null,"database_plan_sha256":null,"artifact_evidence_sha256":null,"device":85,"staging_bytes":0,"budget_bytes":4096,"steps":[{"index":0,"kind":"publish_symlink","path":"etc/café/日本","requires":[],"overwrite":"replace","removal":"require_present","expected":null,"desired":{"kind":"symlink","mode":511,"uid":0,"gid":0,"modified_nanoseconds":0,"size":0,"content_sha256":null,"link_target":"🚀","inode":0,"link_count":0},"source":null,"source_sha256":null,"artifact":null,"staging_entry":"00000000","backup_entry":null}],"steps_sha256":"a86d4c230291986093a3ba1d6599f8a856044d074001a487b22464c4d22b21fe","digest_sha256":"4f81235069b6275be588c3968a9cacd33185e3bd23e62f61dafe074524524dbc"}